{"schema_version":"1.0","bundle_id":"0000000000000000000000000000000000000000000000000000000000000000","run_id":"run-h4-01","adapter_id":"local-adapter","created_at":"2026-09-22T12:00:00Z","decision_id":"0000000000000000000000000000000000000000000000000000000000000000","decision_outcome":"deny","reason_code":"deny","profile_sha256":"0000000000000000000000000000000000000000000000000000000000000000","policy_sha256":"0000000000000000000000000000000000000000000000000000000000000000","intent_digest":"0000000000000000000000000000000000000000000000000000000000000000","operation_id":"read","effective_scope":{"kind":"filesystem","path":"docs/readme.md"},"workspace_id":"workspace","snapshot_digest":"0000000000000000000000000000000000000000000000000000000000000000","read_result_digest":null,"read_result_classification":null,"receipt":null,"verification":{"verification_version":"1.0","canonicalization":"json-c14n-v1","bundle_sha256":"0000000000000000000000000000000000000000000000000000000000000000"},"provenance":{"adapter_version":"1.0","pdp_version":"1.0","pep_version":"not_called","kind":"local_evidence_composition"}}
